{
  "schemaVersion": "1.0",
  "eventId": "0198f2c4-7b1e-7c3a-9d52-3e1f0a6b8c11",
  "assessmentId": "0198f2c4-7a90-7e02-8b1d-5c44e2f7a903",
  "revision": 1,
  "woundId": "0198f1aa-13d4-7f10-a2c8-9b70d3e5c611",
  "patientRef": "p-7f3a9c",
  "deviceId": "dev-a41c",
  "facilityId": "fac-001",
  "capturedAt": "2026-10-03T09:41:12+05:30",
  "analytics": {
    "areaMm2": 412.6,
    "colourRegions": [ { "cluster": 1, "percent": 61.2 }, { "cluster": 2, "percent": 27.9 } ],
    "fitzpatrickClass": "V",
    "pipeline": { "calibration": "2.1.0", "segmentation": "yolo11n-seg-0.4" }
  },
  "clinicalAssessment": {
    "pedalPulses": "not_recorded",
    "protectiveSensation": "absent"
  }
}
